{
  "schema_version": "1.0.0",
  "id": "shapes-example",
  "version": "1",
  "created_at": "2026-01-01T00:00:00Z",
  "ontology": {
    "id": "shapes",
    "version": "1",
    "classes": [
      {
        "id": "circle",
        "label": "Circle"
      }
    ]
  },
  "items": [
    {
      "id": "item-001",
      "image": {
        "path": "image.fixture",
        "sha256": "be7ea33051c971ec95cc7bec0b36dc86b4fb23c4358c7f9befa13fe86cf5d945"
      },
      "width": 100,
      "height": 80,
      "group_id": "scene-001",
      "split": "test",
      "provenance": {
        "source_ref": "fixture:scene-001",
        "acquired_at": "2026-01-01T00:00:00Z"
      },
      "annotation": {
        "id": "ann-001",
        "artifact": {
          "path": "annotation.json",
          "sha256": "493a2f9791eac48f4633dfa2152a754a9281f12e248be305957237309f7525de"
        }
      }
    }
  ]
}
